0
CPU 0:
   0x4ffffffd 0x00: eax=0x00000000 ebx=0x00000000 ecx=0x00000000 edx=0xffffffff
1
CPU 0:
   0x4ffffffd 0x01: eax=0x000939d1 ebx=0xffffa61f ecx=0x00000001 edx=0xffff96af
2
CPU 0:
   0x4ffffffd 0x02: eax=0x00000000 ebx=0xffffa61f ecx=0x00000002 edx=0xffff96af
3
CPU 0:
   0x4ffffffd 0x03: eax=0x00000000 ebx=0xffffa61f ecx=0x00000003 edx=0xffff96af
4
CPU 0:
   0x4ffffffd 0x04: eax=0x00000000 ebx=0xffffa61f ecx=0x00000004 edx=0xffff96af
5
CPU 0:
   0x4ffffffd 0x05: eax=0x00000000 ebx=0x00000000 ecx=0x00000000 edx=0x00000000
6
CPU 0:
   0x4ffffffd 0x06: eax=0x00000000 ebx=0x00000000 ecx=0x00000000 edx=0x00000000
7
CPU 0:
   0x4ffffffd 0x07: eax=0x0003176b ebx=0xffffa61f ecx=0x00000007 edx=0xffff96af
8
CPU 0:
   0x4ffffffd 0x08: eax=0x00000000 ebx=0xffffa61f ecx=0x00000008 edx=0xffff96af
9
CPU 0:
   0x4ffffffd 0x09: eax=0x00000000 ebx=0xffffa61f ecx=0x00000009 edx=0xffff96af
10
CPU 0:
   0x4ffffffd 0x0a: eax=0x00028139 ebx=0xffffa61f ecx=0x0000000a edx=0xffff96af
11
CPU 0:
   0x4ffffffd 0x0b: eax=0x00000000 ebx=0x00000000 ecx=0x00000000 edx=0x00000000
12
CPU 0:
   0x4ffffffd 0x0c: eax=0x0008b3d3 ebx=0xffffa61f ecx=0x0000000c edx=0xffff96af
13
CPU 0:
   0x4ffffffd 0x0d: eax=0x00000000 ebx=0xffffa61f ecx=0x0000000d edx=0xffff96af
14
CPU 0:
   0x4ffffffd 0x0e: eax=0x00000000 ebx=0xffffa61f ecx=0x0000000e edx=0xffff96af
15
CPU 0:
   0x4ffffffd 0x0f: eax=0x00000000 ebx=0xffffa61f ecx=0x0000000f edx=0xffff96af
16
CPU 0:
   0x4ffffffd 0x10: eax=0x00000000 ebx=0xffffa61f ecx=0x00000010 edx=0xffff96af
17
CPU 0:
   0x4ffffffd 0x11: eax=0x00000000 ebx=0x00000000 ecx=0x00000000 edx=0x00000000
18
CPU 0:
   0x4ffffffd 0x12: eax=0x00000000 ebx=0xffffa61f ecx=0x00000012 edx=0xffff96af
19
CPU 0:
   0x4ffffffd 0x13: eax=0x00000000 ebx=0xffffa61f ecx=0x00000013 edx=0xffff96af
20
CPU 0:
   0x4ffffffd 0x14: eax=0x00000000 ebx=0xffffa61f ecx=0x00000014 edx=0xffff96af
21
CPU 0:
   0x4ffffffd 0x15: eax=0x00000000 ebx=0xffffa61f ecx=0x00000015 edx=0xffff96af
22
CPU 0:
   0x4ffffffd 0x16: eax=0x00000000 ebx=0xffffa61f ecx=0x00000016 edx=0xffff96af
23
CPU 0:
   0x4ffffffd 0x17: eax=0x00000000 ebx=0xffffa61f ecx=0x00000017 edx=0xffff96af
24
CPU 0:
   0x4ffffffd 0x18: eax=0x00000000 ebx=0xffffa61f ecx=0x00000018 edx=0xffff96af
25
CPU 0:
   0x4ffffffd 0x19: eax=0x00000000 ebx=0xffffa61f ecx=0x00000019 edx=0xffff96af
26
CPU 0:
   0x4ffffffd 0x1a: eax=0x00000000 ebx=0xffffa61f ecx=0x0000001a edx=0xffff96af
27
CPU 0:
   0x4ffffffd 0x1b: eax=0x00000000 ebx=0xffffa61f ecx=0x0000001b edx=0xffff96af
28
CPU 0:
   0x4ffffffd 0x1c: eax=0x0001facb ebx=0xffffa61f ecx=0x0000001c edx=0xffff96af
29
CPU 0:
   0x4ffffffd 0x1d: eax=0x0000000e ebx=0xffffa61f ecx=0x0000001d edx=0xffff96af
30
CPU 0:
   0x4ffffffd 0x1e: eax=0x0069d66f ebx=0xffffa61f ecx=0x0000001e edx=0xffff96af
31
CPU 0:
   0x4ffffffd 0x1f: eax=0x000067f7 ebx=0xffffa61f ecx=0x0000001f edx=0xffff96af
32
CPU 0:
   0x4ffffffd 0x20: eax=0x001c787a ebx=0xffff96af ecx=0x00000020 edx=0x00000000
33
CPU 0:
   0x4ffffffd 0x21: eax=0x00000000 ebx=0xffffa61f ecx=0x00000021 edx=0xffff96af
34
CPU 0:
   0x4ffffffd 0x22: eax=0x00000000 ebx=0xffffa61f ecx=0x00000022 edx=0xffff96af
35
CPU 0:
   0x4ffffffd 0x23: eax=0x00000000 ebx=0x00000000 ecx=0x00000000 edx=0xffffffff
36
CPU 0:
   0x4ffffffd 0x24: eax=0x00000000 ebx=0xffffa61f ecx=0x00000024 edx=0xffff96af
37
CPU 0:
   0x4ffffffd 0x25: eax=0x00000000 ebx=0xffffa61f ecx=0x00000025 edx=0xffff96af
38
CPU 0:
   0x4ffffffd 0x26: eax=0x00000000 ebx=0x00000000 ecx=0x00000000 edx=0xffffffff
39
CPU 0:
   0x4ffffffd 0x27: eax=0x00000000 ebx=0xffffa61f ecx=0x00000027 edx=0xffff96af
40
CPU 0:
   0x4ffffffd 0x28: eax=0x0003da7f ebx=0xffffa61f ecx=0x00000028 edx=0xffff96af
41
CPU 0:
   0x4ffffffd 0x29: eax=0x00000000 ebx=0xffffa61f ecx=0x00000029 edx=0xffff96af
42
CPU 0:
   0x4ffffffd 0x2a: eax=0x00000000 ebx=0x00000000 ecx=0x00000000 edx=0xffffffff
43
CPU 0:
   0x4ffffffd 0x2b: eax=0x00000000 ebx=0xffffa61f ecx=0x0000002b edx=0xffff96af
44
CPU 0:
   0x4ffffffd 0x2c: eax=0x00000000 ebx=0xffffa61f ecx=0x0000002c edx=0xffff96af
45
CPU 0:
   0x4ffffffd 0x2d: eax=0x00000000 ebx=0xffffa61f ecx=0x0000002d edx=0xffff96af
46
CPU 0:
   0x4ffffffd 0x2e: eax=0x00000000 ebx=0xffffa61f ecx=0x0000002e edx=0xffff96af
47
CPU 0:
   0x4ffffffd 0x2f: eax=0x00000000 ebx=0xffffa61f ecx=0x0000002f edx=0xffff96af
48
CPU 0:
   0x4ffffffd 0x30: eax=0x003f6fbd ebx=0xffffa61f ecx=0x00000030 edx=0xffff96af
49
CPU 0:
   0x4ffffffd 0x31: eax=0x0006383f ebx=0xffffa61f ecx=0x00000031 edx=0xffff96af
50
CPU 0:
   0x4ffffffd 0x32: eax=0x00000000 ebx=0xffffa61f ecx=0x00000032 edx=0xffff96af
51
CPU 0:
   0x4ffffffd 0x33: eax=0x00000000 ebx=0xffffa61f ecx=0x00000033 edx=0xffff96af
52
CPU 0:
   0x4ffffffd 0x34: eax=0x00000000 ebx=0xffffa61f ecx=0x00000034 edx=0xffff96af
53
CPU 0:
   0x4ffffffd 0x35: eax=0x00000000 ebx=0xffff96af ecx=0x00000035 edx=0x00000000
54
CPU 0:
   0x4ffffffd 0x36: eax=0x0000003f ebx=0xffffa61f ecx=0x00000036 edx=0xffff96af
55
CPU 0:
   0x4ffffffd 0x37: eax=0x00000000 ebx=0xffffa61f ecx=0x00000037 edx=0xffff96af
56
CPU 0:
   0x4ffffffd 0x38: eax=0x00000000 ebx=0xffffa61f ecx=0x00000038 edx=0xffff96af
57
CPU 0:
   0x4ffffffd 0x39: eax=0x00000000 ebx=0xffffa61f ecx=0x00000039 edx=0xffff96af
58
CPU 0:
   0x4ffffffd 0x3a: eax=0x00000000 ebx=0xffffa61f ecx=0x0000003a edx=0xffff96af
59
CPU 0:
   0x4ffffffd 0x3b: eax=0x00000000 ebx=0xffffa61f ecx=0x0000003b edx=0xffff96af
60
CPU 0:
   0x4ffffffd 0x3c: eax=0x00000000 ebx=0xffffa61f ecx=0x0000003c edx=0xffff96af
61
CPU 0:
   0x4ffffffd 0x3d: eax=0x00000000 ebx=0xffffa61f ecx=0x0000003d edx=0xffff96af
62
CPU 0:
   0x4ffffffd 0x3e: eax=0x00000000 ebx=0xffffa61f ecx=0x0000003e edx=0xffff96af
63
CPU 0:
   0x4ffffffd 0x3f: eax=0x00000000 ebx=0xffffa61f ecx=0x0000003f edx=0xffff96af
64
CPU 0:
   0x4ffffffd 0x40: eax=0x00000000 ebx=0xffffa61f ecx=0x00000040 edx=0xffff96af
65
CPU 0:
   0x4ffffffd 0x41: eax=0x00000000 ebx=0x00000000 ecx=0x00000000 edx=0xffffffff
66
CPU 0:
   0x4ffffffd 0x42: eax=0x00000000 ebx=0x00000000 ecx=0x00000000 edx=0x00000000
67
CPU 0:
   0x4ffffffd 0x43: eax=0x00000000 ebx=0xffffa61f ecx=0x00000043 edx=0xffff96af
68
CPU 0:
   0x4ffffffd 0x44: eax=0x00000000 ebx=0xffffa61f ecx=0x00000044 edx=0xffff96af
69
CPU 0:
   0x4ffffffd 0x45: eax=0x00000000 ebx=0x00000000 ecx=0x00000000 edx=0x00000000
70
CPU 0:
   0x4ffffffd 0x46: eax=0x00000000 ebx=0x00000000 ecx=0x00000000 edx=0xffffffff
