0
CPU 0:
   0x4ffffffd 0x00: eax=0x00000000 ebx=0x00000000 ecx=0x00000000 edx=0xffffffff
1
CPU 0:
   0x4ffffffd 0x01: eax=0x000e3996 ebx=0xffffb274 ecx=0x00000001 edx=0xffff9ac5
2
CPU 0:
   0x4ffffffd 0x02: eax=0x00000000 ebx=0xffffb274 ecx=0x00000002 edx=0xffff9ac5
3
CPU 0:
   0x4ffffffd 0x03: eax=0x00000000 ebx=0xffffb274 ecx=0x00000003 edx=0xffff9ac5
4
CPU 0:
   0x4ffffffd 0x04: eax=0x00000000 ebx=0xffffb274 ecx=0x00000004 edx=0xffff9ac5
5
CPU 0:
   0x4ffffffd 0x05: eax=0x00000000 ebx=0x00000000 ecx=0x00000000 edx=0x00000000
6
CPU 0:
   0x4ffffffd 0x06: eax=0x00000000 ebx=0x00000000 ecx=0x00000000 edx=0x00000000
7
CPU 0:
   0x4ffffffd 0x07: eax=0x000278f9 ebx=0xffffb274 ecx=0x00000007 edx=0xffff9ac5
8
CPU 0:
   0x4ffffffd 0x08: eax=0x00000000 ebx=0xffffb274 ecx=0x00000008 edx=0xffff9ac5
9
CPU 0:
   0x4ffffffd 0x09: eax=0x00000000 ebx=0xffffb274 ecx=0x00000009 edx=0xffff9ac5
10
CPU 0:
   0x4ffffffd 0x0a: eax=0x000562f3 ebx=0xffffb274 ecx=0x0000000a edx=0xffff9ac5
11
CPU 0:
   0x4ffffffd 0x0b: eax=0x00000000 ebx=0x00000000 ecx=0x00000000 edx=0x00000000
12
CPU 0:
   0x4ffffffd 0x0c: eax=0x0002b26d ebx=0xffffb274 ecx=0x0000000c edx=0xffff9ac5
13
CPU 0:
   0x4ffffffd 0x0d: eax=0x00000000 ebx=0xffffb274 ecx=0x0000000d edx=0xffff9ac5
14
CPU 0:
   0x4ffffffd 0x0e: eax=0x0001c75d ebx=0xffffb274 ecx=0x0000000e edx=0xffff9ac5
15
CPU 0:
   0x4ffffffd 0x0f: eax=0x00000000 ebx=0xffffb274 ecx=0x0000000f edx=0xffff9ac5
16
CPU 0:
   0x4ffffffd 0x10: eax=0x00000000 ebx=0xffffb274 ecx=0x00000010 edx=0xffff9ac5
17
CPU 0:
   0x4ffffffd 0x11: eax=0x00000000 ebx=0x00000000 ecx=0x00000000 edx=0x00000000
18
CPU 0:
   0x4ffffffd 0x12: eax=0x00000000 ebx=0xffffb274 ecx=0x00000012 edx=0xffff9ac5
19
CPU 0:
   0x4ffffffd 0x13: eax=0x00000000 ebx=0xffffb274 ecx=0x00000013 edx=0xffff9ac5
20
CPU 0:
   0x4ffffffd 0x14: eax=0x00000000 ebx=0xffffb274 ecx=0x00000014 edx=0xffff9ac5
21
CPU 0:
   0x4ffffffd 0x15: eax=0x00000000 ebx=0xffffb274 ecx=0x00000015 edx=0xffff9ac5
22
CPU 0:
   0x4ffffffd 0x16: eax=0x00000000 ebx=0xffffb274 ecx=0x00000016 edx=0xffff9ac5
23
CPU 0:
   0x4ffffffd 0x17: eax=0x00000000 ebx=0xffffb274 ecx=0x00000017 edx=0xffff9ac5
24
CPU 0:
   0x4ffffffd 0x18: eax=0x00000000 ebx=0xffffb274 ecx=0x00000018 edx=0xffff9ac5
25
CPU 0:
   0x4ffffffd 0x19: eax=0x00000000 ebx=0xffffb274 ecx=0x00000019 edx=0xffff9ac5
26
CPU 0:
   0x4ffffffd 0x1a: eax=0x00000000 ebx=0xffffb274 ecx=0x0000001a edx=0xffff9ac5
27
CPU 0:
   0x4ffffffd 0x1b: eax=0x00000000 ebx=0xffffb274 ecx=0x0000001b edx=0xffff9ac5
28
CPU 0:
   0x4ffffffd 0x1c: eax=0x0030bfd0 ebx=0xffffb274 ecx=0x0000001c edx=0xffff9ac5
29
CPU 0:
   0x4ffffffd 0x1d: eax=0x0000000b ebx=0xffffb274 ecx=0x0000001d edx=0xffff9ac5
30
CPU 0:
   0x4ffffffd 0x1e: eax=0x006af14c ebx=0xffffb274 ecx=0x0000001e edx=0xffff9ac5
31
CPU 0:
   0x4ffffffd 0x1f: eax=0x00000aef ebx=0xffffb274 ecx=0x0000001f edx=0xffff9ac5
32
CPU 0:
   0x4ffffffd 0x20: eax=0x000acf72 ebx=0xffffb274 ecx=0x00000020 edx=0xffff9ac5
33
CPU 0:
   0x4ffffffd 0x21: eax=0x00006146 ebx=0xffffb274 ecx=0x00000021 edx=0xffff9ac5
34
CPU 0:
   0x4ffffffd 0x22: eax=0x00000000 ebx=0xffffb274 ecx=0x00000022 edx=0xffff9ac5
35
CPU 0:
   0x4ffffffd 0x23: eax=0x00000000 ebx=0x00000000 ecx=0x00000000 edx=0xffffffff
36
CPU 0:
   0x4ffffffd 0x24: eax=0x00000000 ebx=0xffffb274 ecx=0x00000024 edx=0xffff9ac5
37
CPU 0:
   0x4ffffffd 0x25: eax=0x00000000 ebx=0xffffb274 ecx=0x00000025 edx=0xffff9ac5
38
CPU 0:
   0x4ffffffd 0x26: eax=0x00000000 ebx=0x00000000 ecx=0x00000000 edx=0xffffffff
39
CPU 0:
   0x4ffffffd 0x27: eax=0x00000000 ebx=0xffffb274 ecx=0x00000027 edx=0xffff9ac5
40
CPU 0:
   0x4ffffffd 0x28: eax=0x00030c5f ebx=0xffffb274 ecx=0x00000028 edx=0xffff9ac5
41
CPU 0:
   0x4ffffffd 0x29: eax=0x00000000 ebx=0xffffb274 ecx=0x00000029 edx=0xffff9ac5
42
CPU 0:
   0x4ffffffd 0x2a: eax=0x00000000 ebx=0x00000000 ecx=0x00000000 edx=0xffffffff
43
CPU 0:
   0x4ffffffd 0x2b: eax=0x00000000 ebx=0xffffb274 ecx=0x0000002b edx=0xffff9ac5
44
CPU 0:
   0x4ffffffd 0x2c: eax=0x00000000 ebx=0xffffb274 ecx=0x0000002c edx=0xffff9ac5
45
CPU 0:
   0x4ffffffd 0x2d: eax=0x00000000 ebx=0xffffb274 ecx=0x0000002d edx=0xffff9ac5
46
CPU 0:
   0x4ffffffd 0x2e: eax=0x00000000 ebx=0xffffb274 ecx=0x0000002e edx=0xffff9ac5
47
CPU 0:
   0x4ffffffd 0x2f: eax=0x00000000 ebx=0xffffb274 ecx=0x0000002f edx=0xffff9ac5
48
CPU 0:
   0x4ffffffd 0x30: eax=0x0021a07f ebx=0xffffb274 ecx=0x00000030 edx=0xffff9ac5
49
CPU 0:
   0x4ffffffd 0x31: eax=0x00020aed ebx=0xffffb274 ecx=0x00000031 edx=0xffff9ac5
50
CPU 0:
   0x4ffffffd 0x32: eax=0x00000000 ebx=0xffffb274 ecx=0x00000032 edx=0xffff9ac5
51
CPU 0:
   0x4ffffffd 0x33: eax=0x00000000 ebx=0xffffb274 ecx=0x00000033 edx=0xffff9ac5
52
CPU 0:
   0x4ffffffd 0x34: eax=0x00000000 ebx=0xffffb274 ecx=0x00000034 edx=0xffff9ac5
53
CPU 0:
   0x4ffffffd 0x35: eax=0x00000000 ebx=0xffffb274 ecx=0x00000035 edx=0xffff9ac5
54
CPU 0:
   0x4ffffffd 0x36: eax=0x00000031 ebx=0xffffb274 ecx=0x00000036 edx=0xffff9ac5
55
CPU 0:
   0x4ffffffd 0x37: eax=0x00000000 ebx=0xffffb274 ecx=0x00000037 edx=0xffff9ac5
56
CPU 0:
   0x4ffffffd 0x38: eax=0x00000000 ebx=0xffffb274 ecx=0x00000038 edx=0xffff9ac5
57
CPU 0:
   0x4ffffffd 0x39: eax=0x00000000 ebx=0xffffb274 ecx=0x00000039 edx=0xffff9ac5
58
CPU 0:
   0x4ffffffd 0x3a: eax=0x00000000 ebx=0xffffb274 ecx=0x0000003a edx=0xffff9ac5
59
CPU 0:
   0x4ffffffd 0x3b: eax=0x00000000 ebx=0xffffb274 ecx=0x0000003b edx=0xffff9ac5
60
CPU 0:
   0x4ffffffd 0x3c: eax=0x00000000 ebx=0xffffb274 ecx=0x0000003c edx=0xffff9ac5
61
CPU 0:
   0x4ffffffd 0x3d: eax=0x00000000 ebx=0xffffb274 ecx=0x0000003d edx=0xffff9ac5
62
CPU 0:
   0x4ffffffd 0x3e: eax=0x00000000 ebx=0xffffb274 ecx=0x0000003e edx=0xffff9ac5
63
CPU 0:
   0x4ffffffd 0x3f: eax=0x00000000 ebx=0xffffb274 ecx=0x0000003f edx=0xffff9ac5
64
CPU 0:
   0x4ffffffd 0x40: eax=0x00000000 ebx=0xffffb274 ecx=0x00000040 edx=0xffff9ac5
65
CPU 0:
   0x4ffffffd 0x41: eax=0x00000000 ebx=0x00000000 ecx=0x00000000 edx=0xffffffff
66
CPU 0:
   0x4ffffffd 0x42: eax=0x00000000 ebx=0x00000000 ecx=0x00000000 edx=0x00000000
67
CPU 0:
   0x4ffffffd 0x43: eax=0x00000000 ebx=0xffffb274 ecx=0x00000043 edx=0xffff9ac5
68
CPU 0:
   0x4ffffffd 0x44: eax=0x00000000 ebx=0xffffb274 ecx=0x00000044 edx=0xffff9ac5
69
CPU 0:
   0x4ffffffd 0x45: eax=0x00000000 ebx=0x00000000 ecx=0x00000000 edx=0x00000000
70
CPU 0:
   0x4ffffffd 0x46: eax=0x00000000 ebx=0x00000000 ecx=0x00000000 edx=0xffffffff
